,Date,Favorites,HashTags,Mentions,Retweets,Text,location,target,user_split,user_text
642,2019-12-22 13:25:01+00:00,0,#williesimmons,None,4,"Please read this thread. If you’re moved like I am- let’s flood Willie with cards of good cheer. It’s the least we can do #williesimmons Inmate Mailing Address: Willie Junior Simmons, 00112862 Holman Correctional Facility Holman 3700 A-57 Atmore, AL 36503-3700",WI,0,Jesshendy,"Jesshendy Please read this thread. If you’re moved like I am- let’s flood Willie with cards of good cheer. It’s the least we can do #williesimmons Inmate Mailing Address: Willie Junior Simmons, 00112862 Holman Correctional Facility Holman 3700 A-57 Atmore, AL 36503-3700"
643,2019-12-22 12:54:34+00:00,1,#linkinbio #newvideo #TooBusyWinning #FLOOD #FOE #SOLID #houston #wshh,None,1,"Who y’all wanna hear me work with #2020 @em #linkinbio #newvideo #TooBusyWinning #FLOOD #FOE #SOLID #houston #wshh @Houston, Texas https://www.instagram.com/p/B6YBhsEg6JD/?igshid=npah2832z99v",WI,0,TBWSirSpitta,"TBWSirSpitta Who y’all wanna hear me work with #2020 @em #linkinbio #newvideo #TooBusyWinning #FLOOD #FOE #SOLID #houston #wshh @Houston, Texas https://www.instagram.com/p/B6YBhsEg6JD/?igshid=npah2832z99v"
644,2019-12-22 12:11:31+00:00,0,#31DaysofPeace,None,0,"Day #22 #31DaysofPeace The Lord sat enthroned at the Flood, And the Lord sits as King forever. The Lord will give strength to His people; The Lord will bless His people with… https://www.instagram.com/p/B6X83OfpSNP0aO_MYC4Ob01p2cgF5Ynb2211es0/?igshid=ojfzt6m49hwn",WI,0,IamMinaLove,"IamMinaLove Day #22 #31DaysofPeace The Lord sat enthroned at the Flood, And the Lord sits as King forever. The Lord will give strength to His people; The Lord will bless His people with… https://www.instagram.com/p/B6X83OfpSNP0aO_MYC4Ob01p2cgF5Ynb2211es0/?igshid=ojfzt6m49hwn"
645,2019-12-22 11:22:14+00:00,1,None,@GGYOUNGBOY,3,Man drop this shit RN so I can flood the tl w/videos I already know this lil part though @GGYOUNGBOY,WI,0,Only1 tericaa,Only1 tericaa Man drop this shit RN so I can flood the tl w/videos I already know this lil part though @GGYOUNGBOY
646,2019-12-22 10:52:03+00:00,0,#Manhattan,None,25,Im ready to smoke a blunt and flood sum guts #Manhattan,WI,0,freakylilchito1,freakylilchito1 Im ready to smoke a blunt and flood sum guts #Manhattan
647,2019-12-22 08:59:28+00:00,0,None,None,2,Time to go flood my mouth again ,WI,0,Lanyard  ,Lanyard   Time to go flood my mouth again 
648,2019-12-22 08:58:15+00:00,0,None,None,0,FLOOD ,WI,0, dopeMUNY, dopeMUNY FLOOD 
649,2019-12-22 08:46:55+00:00,1,None,None,0,"Been there, done that. Circa 2011-2013. Floods was a fool. ",WI,0,TimelineTsunami,"TimelineTsunami Been there, done that. Circa 2011-2013. Floods was a fool. "
650,2019-12-22 07:42:43+00:00,4,None,None,1,Grown ass women begging to being fucked by Dababy and AsapRocky and grown niggas judging their dicks??? God can send the flood now,WI,0,twerk4cam,twerk4cam Grown ass women begging to being fucked by Dababy and AsapRocky and grown niggas judging their dicks??? God can send the flood now
651,2019-12-22 07:13:43+00:00,0,None,None,0,"A job is a job! The planet is convulsing! Hurricanes, tornadoes, floods, droughts are symptoms!",WI,0,nursevictoria11,"nursevictoria11 A job is a job! The planet is convulsing! Hurricanes, tornadoes, floods, droughts are symptoms!"
652,2019-12-22 06:45:20+00:00,0,None,None,2,Matthew... log off...,WI,0,NorthstarAlex,NorthstarAlex Matthew... log off...
653,2019-12-22 06:18:22+00:00,1,None,None,0,God please send the flood. ,WI,0,XxskyroeXx,XxskyroeXx God please send the flood. 
654,2019-12-22 05:58:24+00:00,0,None,None,0,Yeah god can send the flood now ,WI,0,twerk4cam,twerk4cam Yeah god can send the flood now 
655,2019-12-22 05:55:19+00:00,0,None,None,3,Not in the flash flood warning.. ,WI,0,Melessieee,Melessieee Not in the flash flood warning.. 
656,2019-12-22 05:30:55+00:00,1,None,None,3,"Lk, 17 v 26- 27 just as the day of Noah, ppl were drinking , n eating, being given in marriage, up to the day Noah entered the ark, then the flood came n destroyed them all. Obedience is better than sacrifice n to hearken is better than the fat of Rams, Sam,15:22.",WI,0,badekale20,"badekale20 Lk, 17 v 26- 27 just as the day of Noah, ppl were drinking , n eating, being given in marriage, up to the day Noah entered the ark, then the flood came n destroyed them all. Obedience is better than sacrifice n to hearken is better than the fat of Rams, Sam,15:22."
657,2019-12-22 05:30:22+00:00,0,None,None,1,“Episode 8 was a great film.” Nick you’re opening the flood gate.,WI,0,Jonathan Skee,Jonathan Skee “Episode 8 was a great film.” Nick you’re opening the flood gate.
658,2019-12-22 05:07:37+00:00,0,None,None,4,9 days left in the year and y’all just wanted to flood the TL with a buncha dicks huh ,WI,0,iamjeiru,iamjeiru 9 days left in the year and y’all just wanted to flood the TL with a buncha dicks huh 
659,2019-12-22 04:59:56+00:00,0,None,None,0,Look at all the disaster happening around the globe. Stop using witch Craft and voudo. Any type of magic is not good. That is why all The Fire Floods. National disaster are Right Now happening..,WI,0,JasonMontague19,JasonMontague19 Look at all the disaster happening around the globe. Stop using witch Craft and voudo. Any type of magic is not good. That is why all The Fire Floods. National disaster are Right Now happening..
660,2019-12-22 04:58:44+00:00,0,None,@EffinOfficial,4,Flood @EffinOfficial – at Hammerstein Ballroom,WI,0,shantymane,shantymane Flood @EffinOfficial – at Hammerstein Ballroom
661,2019-12-22 04:43:49+00:00,0,#actoradvocateandyarias,None,1,Hey LA flood I’m coming home for a week! I’m itching to get on stage and make people laugh! If you have an open sad and want to sexy funny sassy boy on wheels let me know!! XXOXO #actoradvocateandyarias… https://www.instagram.com/p/B6XJoEzpKVX/?igshid=4pviqeqf139j,WI,0,andyzwheelz,andyzwheelz Hey LA flood I’m coming home for a week! I’m itching to get on stage and make people laugh! If you have an open sad and want to sexy funny sassy boy on wheels let me know!! XXOXO #actoradvocateandyarias… https://www.instagram.com/p/B6XJoEzpKVX/?igshid=4pviqeqf139j
662,2019-12-22 04:39:45+00:00,1,None,None,3,"Let the man Rest In Peace damn. And save all the stupid BS y’all about to flood my mentions with. Trust me I know, I still said what I said. ",WI,0,kiannalakaye,"kiannalakaye Let the man Rest In Peace damn. And save all the stupid BS y’all about to flood my mentions with. Trust me I know, I still said what I said. "
663,2019-12-22 04:37:33+00:00,0,None,None,0,Metaphor for god/Mother Nature and the destruction/rebirth of earth via the flood,WI,0,jacobcook994,jacobcook994 Metaphor for god/Mother Nature and the destruction/rebirth of earth via the flood
664,2019-12-22 04:29:10+00:00,1,None,None,1,OUR HOMELESS PRESIDENT AWARDED NASA (A PRIVATELY HELD COMPANY ON THE NYSE) TRILLIONS OF DOLLARS... WHILE WE THE PEOPLE WERE TERRORIZED BY MANMADE EARTHQUAKES FLOODS FIRES DRONES... FOR FRAUDULENT INSURANCE CLAIMS.,WI,0,hm belcher,hm belcher OUR HOMELESS PRESIDENT AWARDED NASA (A PRIVATELY HELD COMPANY ON THE NYSE) TRILLIONS OF DOLLARS... WHILE WE THE PEOPLE WERE TERRORIZED BY MANMADE EARTHQUAKES FLOODS FIRES DRONES... FOR FRAUDULENT INSURANCE CLAIMS.
665,2019-12-22 04:25:31+00:00,0,None,None,0,2nd story bedrooms are awesome...2nd story bathrooms are recipe for children to flood ceilings.,WI,0,TimChartersn5,TimChartersn5 2nd story bedrooms are awesome...2nd story bathrooms are recipe for children to flood ceilings.
666,2019-12-22 04:24:52+00:00,2,None,None,8,Inspiration floods the basin of my being There are some connections Without question You know will be for life In those moments you already feel the growth Even so with the ones you have to let go of to make room to effloresce,WI,0,HangryPoet197,HangryPoet197 Inspiration floods the basin of my being There are some connections Without question You know will be for life In those moments you already feel the growth Even so with the ones you have to let go of to make room to effloresce
667,2019-12-22 04:13:21+00:00,0,None,None,0,Holland will have the blues when climate change encouraged by Stupidicus trump floods Holland.,WI,0,WTR4U,WTR4U Holland will have the blues when climate change encouraged by Stupidicus trump floods Holland.
668,2019-12-22 04:07:11+00:00,0,None,None,2,FROZEN 2 SPOILER have you guys ever thought about the irony of the song some things never change....the chorus literally says “like an old stone wall that will never fall” but it in fact does fall (the flood) frozen really out here teachin,WI,0,elysegraceb,elysegraceb FROZEN 2 SPOILER have you guys ever thought about the irony of the song some things never change....the chorus literally says “like an old stone wall that will never fall” but it in fact does fall (the flood) frozen really out here teachin
669,2019-12-22 04:00:19+00:00,1,#ARE #YOU #NEW #THIS #AMAZING #Free #Viral #Video #System #Grows #Your #Instagram #Followers #like #Crazy #FLOOD #RAIN #You #Love #because #WILL #Helps,None,0,#ARE #YOU #NEW TO INSTAGRAM ? #THIS #AMAZING #Free #Viral #Video #System #Grows #Your #Instagram #Followers #like a #Crazy #FLOOD of #RAIN ! http://IGMoneyTree.com/mrgetrich7 #You will #Love it #because it #WILL #Helps… https://www.instagram.com/p/B6XEpgwHW5_/?igshid=u1amvf3o0hqd,WI,0,WillieParnell,WillieParnell #ARE #YOU #NEW TO INSTAGRAM ? #THIS #AMAZING #Free #Viral #Video #System #Grows #Your #Instagram #Followers #like a #Crazy #FLOOD of #RAIN ! http://IGMoneyTree.com/mrgetrich7 #You will #Love it #because it #WILL #Helps… https://www.instagram.com/p/B6XEpgwHW5_/?igshid=u1amvf3o0hqd
670,2019-12-22 03:54:50+00:00,0,None,None,0,I’m gonna go get a bottle of wine and flood my story/TL with my face.,WI,0,JustScarlette,JustScarlette I’m gonna go get a bottle of wine and flood my story/TL with my face.
671,2019-12-22 03:10:56+00:00,0,None,@god,0,Grown ass men already tweeting about another rapper's meat. Send the flood my guy @God,WI,0,GodElJay,GodElJay Grown ass men already tweeting about another rapper's meat. Send the flood my guy @God
672,2019-12-22 03:08:19+00:00,11,None,None,45,We need to flood our senators especially our Repuglican senators with this report. Do we stand up to Putin and Russia or do we not?,WI,0,hxernst,hxernst We need to flood our senators especially our Repuglican senators with this report. Do we stand up to Putin and Russia or do we not?
673,2019-12-22 02:55:49+00:00,0,#Mural #JacksonPollack,None,0,Hope you enjoy the amazing journey of #Mural the #JacksonPollack masterpiece that has been traveling for over a decade (since the flood of 2008) https://magazine.foriowa.org/story.php?ed=true&amp;storyid=1912,WI,0,CharlesMBrenner,CharlesMBrenner Hope you enjoy the amazing journey of #Mural the #JacksonPollack masterpiece that has been traveling for over a decade (since the flood of 2008) https://magazine.foriowa.org/story.php?ed=true&amp;storyid=1912
674,2019-12-22 00:35:55+00:00,0,None,None,1,"Great news for Offutt AFB and the NE Guard, allowing us to rebuild after the flood. ",WI,0,mikesell jeff,"mikesell jeff Great news for Offutt AFB and the NE Guard, allowing us to rebuild after the flood. "
675,2019-12-21 22:17:51+00:00,0,#Iowa #ia03 #flooding #ClimateChange #iapolitics #ClimateAction #actonclimatechange #Flood19,@RepCindyAxne,2,Thank you @RepCindyAxne for speaking on flood relief &amp; working on updating our levees across #Iowa #ia03 #flooding #ClimateChange #iapolitics #ClimateAction #actonclimatechange #Flood19 – at Guthrie Center Community Building,WI,0,tylergrangerIA,tylergrangerIA Thank you @RepCindyAxne for speaking on flood relief &amp; working on updating our levees across #Iowa #ia03 #flooding #ClimateChange #iapolitics #ClimateAction #actonclimatechange #Flood19 – at Guthrie Center Community Building
676,2019-12-21 21:20:58+00:00,0,None,None,0,Ayo Floods mad packed yesterday lol. I gotta go when it’s less crowded,WI,0,BLVKmisfit,BLVKmisfit Ayo Floods mad packed yesterday lol. I gotta go when it’s less crowded
677,2019-12-21 19:34:07+00:00,0,#JOLABOKAFLOD #GiveTheGiftOfBooks #AndChocolate,None,1,"We're embracing the Icelandic tradition of #JOLABOKAFLOD (Yule Book Flood), a time for snuggling in with books and chocolate. To help you celebrate, we're giving out free chocolate with any book purchase all weekend and Christmas Eve! #GiveTheGiftOfBooks #AndChocolate ⁣ – at Hartfield Book Company",WI,0,HartfieldBooks,"HartfieldBooks We're embracing the Icelandic tradition of #JOLABOKAFLOD (Yule Book Flood), a time for snuggling in with books and chocolate. To help you celebrate, we're giving out free chocolate with any book purchase all weekend and Christmas Eve! #GiveTheGiftOfBooks #AndChocolate ⁣ – at Hartfield Book Company"
678,2019-12-21 18:55:51+00:00,1,None,None,2,"I grew up in Mound City, and we went to Tarkio often. I had several friends who went to college there. It truly has never recovered as you said. And the flood damage this yearin my home county — Holt, is heartbreaking. The new school will hopefully bring life back to that area.",WI,0,kayhoflander,"kayhoflander I grew up in Mound City, and we went to Tarkio often. I had several friends who went to college there. It truly has never recovered as you said. And the flood damage this yearin my home county — Holt, is heartbreaking. The new school will hopefully bring life back to that area."
679,2019-12-21 18:38:24+00:00,0,None,@realDonaldTrump,0,@realDonaldTrump LISTEN have a game plan for 2020 its going to be a difficult year okay? I saw it all disasters like crazy are going to happen. I will do my best to protect all of you but prepare for the floods and destruction of the infrastructure of America. BE READY!! ,WI,0,CourtneySPace7,CourtneySPace7 @realDonaldTrump LISTEN have a game plan for 2020 its going to be a difficult year okay? I saw it all disasters like crazy are going to happen. I will do my best to protect all of you but prepare for the floods and destruction of the infrastructure of America. BE READY!! 
680,2019-12-21 18:31:25+00:00,0,None,None,0,Yes without having to worry about hurricanes and floods and shit ! ,WI,0,IGjasmaine  ,IGjasmaine   Yes without having to worry about hurricanes and floods and shit ! 
681,2019-12-21 15:39:49+00:00,0,None,None,0,"I thought inflation only occurred when the Fed floods the market with new money so if the $1000 for everyone isn’t being created out of thin air but redistributed, we still can’t avoid inflation? Thx for your response. Huge supporter.",WI,0,CallMeKennyG,"CallMeKennyG I thought inflation only occurred when the Fed floods the market with new money so if the $1000 for everyone isn’t being created out of thin air but redistributed, we still can’t avoid inflation? Thx for your response. Huge supporter."
682,2019-12-21 14:54:20+00:00,14,None,None,21,OKAY RISISTER SISTERS AND BROTHERS!!!! LET'S GO!!! GET AFTER TWITTER AND DEMAND THAT THEY REINSTATE OUR SISTER'S ACCOUNT N O W!!!! FLOOD EM AND DON'T STOP TILL SHE'S BACK! NOW GO GO GO GO GO!!!! ,WI,0,astern5556,astern5556 OKAY RISISTER SISTERS AND BROTHERS!!!! LET'S GO!!! GET AFTER TWITTER AND DEMAND THAT THEY REINSTATE OUR SISTER'S ACCOUNT N O W!!!! FLOOD EM AND DON'T STOP TILL SHE'S BACK! NOW GO GO GO GO GO!!!! 
683,2019-12-21 14:46:37+00:00,0,None,None,24,"Im down in the lobby this morning at the Doubletree in Evansville on game day. It’s doesn’t seem right without a flood of blue and gold clad fans roaming about talking about the game. Ahhh, but come March, Murray will be out in force. ",WI,0,NealBradley,"NealBradley Im down in the lobby this morning at the Doubletree in Evansville on game day. It’s doesn’t seem right without a flood of blue and gold clad fans roaming about talking about the game. Ahhh, but come March, Murray will be out in force. "
684,2019-12-21 14:24:31+00:00,3,#putKENSin,@ProFootballHOF @NFL,6,Challenging everyone to call @ProFootballHOF at 330-456-8207 to voice their displeasure with Ken Anderson and Ken Riley not getting into HOF - yet again. Absolutely embarrassing for @NFL FLOOD THE PHONE LINES! #putKENSin .....i just left a message ,WI,0,bengaljims BTR,bengaljims BTR Challenging everyone to call @ProFootballHOF at 330-456-8207 to voice their displeasure with Ken Anderson and Ken Riley not getting into HOF - yet again. Absolutely embarrassing for @NFL FLOOD THE PHONE LINES! #putKENSin .....i just left a message 
685,2019-12-21 10:13:56+00:00,0,None,None,26,I am an academic librarian and like to deal in facts. Here's a fully sourced article on the topic:,WI,0,KateSherrill,KateSherrill I am an academic librarian and like to deal in facts. Here's a fully sourced article on the topic:
686,2019-12-21 09:49:43+00:00,0,None,None,17,"Olivia, I am in America and what you are saying is totally incorrect. The benefits received by families in need are insufficient and being reduced more and more all the time.",WI,0,KateSherrill,"KateSherrill Olivia, I am in America and what you are saying is totally incorrect. The benefits received by families in need are insufficient and being reduced more and more all the time."
687,2019-12-21 06:52:35+00:00,0,None,None,0,"The Giant in me will awaken in 2020 be prepared you will be annoyed wit my music and movement, just stick around please I promise I won’t try n do too much n flood your timeline",WI,0,AZfromKC,"AZfromKC The Giant in me will awaken in 2020 be prepared you will be annoyed wit my music and movement, just stick around please I promise I won’t try n do too much n flood your timeline"
688,2019-12-21 03:46:59+00:00,0,None,None,1,"Murnau: ""Hi! Other roommate mentioned! I guess LadyMissPrincess is right, but why are we not talking about my tail??? It's on Instagram! Also, I'm showing ALL the flood on CatHub, this Saturday! ^_^"" Phoebe: THEN PAY SOME RENT!! Nigel: Guys, stop! My marriage is falling apart!!",WI,0,ruadhan1334,"ruadhan1334 Murnau: ""Hi! Other roommate mentioned! I guess LadyMissPrincess is right, but why are we not talking about my tail??? It's on Instagram! Also, I'm showing ALL the flood on CatHub, this Saturday! ^_^"" Phoebe: THEN PAY SOME RENT!! Nigel: Guys, stop! My marriage is falling apart!!"
689,2019-12-21 03:19:45+00:00,0,None,None,0,Floods jumpin per usual,WI,0,BluCreationz,BluCreationz Floods jumpin per usual
690,2019-12-21 03:19:35+00:00,1,None,None,0,Guess I’ll go to futures or floods maybe even vivid too just to have a drink or 10 ,WI,0,Shianne    ,Shianne     Guess I’ll go to futures or floods maybe even vivid too just to have a drink or 10 
691,2019-12-21 02:53:56+00:00,0,None,None,0,Can’t wait. This team would have at least a few more wins with him.,WI,0,Ctg2223,Ctg2223 Can’t wait. This team would have at least a few more wins with him.
692,2019-12-21 02:08:19+00:00,4,None,@ProFootballHOF @nflcommish @NFL,4,Call and call again! 330-456-8207 PUT KEN ANDERSON IN @ProFootballHOF they are now hanging up on us (no one is being rude). Flood VM messages with your thoughts! @nflcommish @NFL,WI,0,bengaljims BTR,bengaljims BTR Call and call again! 330-456-8207 PUT KEN ANDERSON IN @ProFootballHOF they are now hanging up on us (no one is being rude). Flood VM messages with your thoughts! @nflcommish @NFL
693,2019-12-21 02:07:38+00:00,0,None,None,1,Floods worse,WI,0,Sadittee ,Sadittee  Floods worse
694,2019-12-21 01:42:49+00:00,1,None,None,25,"Great first couple of days scouting the holiday tournaments at Groton/Lawrence, Flood Marr and St. Sebastian’s. A lot of great talent out there. ",WI,0,JeffCoxSports,"JeffCoxSports Great first couple of days scouting the holiday tournaments at Groton/Lawrence, Flood Marr and St. Sebastian’s. A lot of great talent out there. "
695,2019-12-21 00:56:53+00:00,0,None,None,1,That’s because I’m not there. But I am VERY HAPPY to see it!!! ,WI,0,kristy527,kristy527 That’s because I’m not there. But I am VERY HAPPY to see it!!! 
696,2019-12-21 00:43:45+00:00,0,None,None,0,"Respect to Gloria Steinem, Jane Fonda and many other activists. Today’s topic: Climate change and its effects on human health. 1. Temperature-related illnesses 2. Air quality impacts; asthma, cancers 3. Extreme events; floods, hurricanes, fires 4. Vector-borne diseases etc.",WI,0,Lschottner1968,"Lschottner1968 Respect to Gloria Steinem, Jane Fonda and many other activists. Today’s topic: Climate change and its effects on human health. 1. Temperature-related illnesses 2. Air quality impacts; asthma, cancers 3. Extreme events; floods, hurricanes, fires 4. Vector-borne diseases etc."
697,2019-12-21 00:15:59+00:00,0,None,None,0,Flood complete both teams back. Start of 2nd shortly,WI,0,lhhslionshockey,lhhslionshockey Flood complete both teams back. Start of 2nd shortly
698,2019-12-21 00:15:59+00:00,0,#StarWarsRiseofSkywalker #StarWars9,None,6,What’s the o/u for how many times I’ll flood the theater for #StarWarsRiseofSkywalker? #StarWars9 – at Flix Brewhouse,WI,0,NotTheFakeWags,NotTheFakeWags What’s the o/u for how many times I’ll flood the theater for #StarWarsRiseofSkywalker? #StarWars9 – at Flix Brewhouse
699,2019-12-20 23:52:23+00:00,1,#flood #NDMA,None,0,This is a sample message from a disaster victim. #flood #NDMA,WI,0,david hadaller,david hadaller This is a sample message from a disaster victim. #flood #NDMA
700,2019-12-20 23:29:12+00:00,0,None,None,0,Just arriving so warm ups complete and flood done we are now into oh Canada,WI,0,lhhslionshockey,lhhslionshockey Just arriving so warm ups complete and flood done we are now into oh Canada
701,2019-12-20 23:06:57+00:00,0,None,None,1,Does it flood in Brandon? Wonder if this thing can traverse flooded areas where other vehicles can't.,WI,0,aggieloveseggs,aggieloveseggs Does it flood in Brandon? Wonder if this thing can traverse flooded areas where other vehicles can't.
702,2019-12-20 23:01:21+00:00,0,None,None,30,"Just turned in the Grand Cherokee Trailhawk. 3 years, 36k-ish miles of completely trouble free comfort. Got us through Harvey flooding and other miscellaneous floods. Loved this thing, and bittersweet to see it go. ",WI,0,SpeedSportLife,"SpeedSportLife Just turned in the Grand Cherokee Trailhawk. 3 years, 36k-ish miles of completely trouble free comfort. Got us through Harvey flooding and other miscellaneous floods. Loved this thing, and bittersweet to see it go. "
703,2016-06-23 23:59:36+00:00,0,#nmwx #nm,None,0,"Flash flood warning until 7 PM #nmwx #nm @Albuquerque, New Mexico https://www.instagram.com/p/BHBCyLQB-jK/",TX,1,LisaAbeyta,"LisaAbeyta Flash flood warning until 7 PM #nmwx #nm @Albuquerque, New Mexico https://www.instagram.com/p/BHBCyLQB-jK/"
704,2016-06-23 23:53:45+00:00,0,#RLX,None,0,"At 7:51 PM, 2 NNE Rush [Boyd Co, KY] EMERGENCY MNGR reports FLASH FLOOD #RLX http://mesonet.agron.iastate.edu/lsr/#RLX/201606232351/201606232351",TX,1,iembot rlx,"iembot rlx At 7:51 PM, 2 NNE Rush [Boyd Co, KY] EMERGENCY MNGR reports FLASH FLOOD #RLX http://mesonet.agron.iastate.edu/lsr/#RLX/201606232351/201606232351"
705,2016-06-23 23:50:46+00:00,0,#RLX,None,0,"At 7:48 PM, 4 SSE Rush [Boyd Co, KY] EMERGENCY MNGR reports FLASH FLOOD #RLX http://mesonet.agron.iastate.edu/lsr/#RLX/201606232348/201606232348",TX,1,iembot rlx,"iembot rlx At 7:48 PM, 4 SSE Rush [Boyd Co, KY] EMERGENCY MNGR reports FLASH FLOOD #RLX http://mesonet.agron.iastate.edu/lsr/#RLX/201606232348/201606232348"
706,2016-06-23 23:48:01+00:00,0,#RLX,None,0,"At 7:44 PM, Rush [Boyd Co, KY] EMERGENCY MNGR reports FLASH FLOOD #RLX http://mesonet.agron.iastate.edu/lsr/#RLX/201606232344/201606232344",TX,1,iembot rlx,"iembot rlx At 7:44 PM, Rush [Boyd Co, KY] EMERGENCY MNGR reports FLASH FLOOD #RLX http://mesonet.agron.iastate.edu/lsr/#RLX/201606232344/201606232344"
707,2016-06-23 22:27:16+00:00,0,#RLX,None,0,"At 6:03 PM, 3 SW Amma [Roane Co, WV] DEPT OF HIGHWAYS reports FLASH FLOOD #RLX http://mesonet.agron.iastate.edu/lsr/#RLX/201606232203/201606232203",TX,1,iembot rlx,"iembot rlx At 6:03 PM, 3 SW Amma [Roane Co, WV] DEPT OF HIGHWAYS reports FLASH FLOOD #RLX http://mesonet.agron.iastate.edu/lsr/#RLX/201606232203/201606232203"
708,2016-06-23 22:23:57+00:00,0,#RNK,None,0,"At 6:00 PM, Renick [Greenbrier Co, WV] EMERGENCY MNGR reports FLASH FLOOD #RNK http://mesonet.agron.iastate.edu/lsr/#RNK/201606232200/201606232200",TX,1,iembot rnk,"iembot rnk At 6:00 PM, Renick [Greenbrier Co, WV] EMERGENCY MNGR reports FLASH FLOOD #RNK http://mesonet.agron.iastate.edu/lsr/#RNK/201606232200/201606232200"
709,2016-06-23 22:15:10+00:00,0,None,None,1,"Added the location...check it in, check it in... - Drinking a Tottenham Flood Porter @Right Mind Brewing - http://untp.beer/s/c327023599",TX,1,hucksbeerbuzz,"hucksbeerbuzz Added the location...check it in, check it in... - Drinking a Tottenham Flood Porter @Right Mind Brewing - http://untp.beer/s/c327023599"
710,2016-06-23 22:00:22+00:00,0,#RLX,None,0,"At 5:58 PM, 1 NE Rush [Boyd Co, KY] 911 CALL CENTER reports FLASH FLOOD #RLX http://mesonet.agron.iastate.edu/lsr/#RLX/201606232158/201606232158",TX,1,iembot rlx,"iembot rlx At 5:58 PM, 1 NE Rush [Boyd Co, KY] 911 CALL CENTER reports FLASH FLOOD #RLX http://mesonet.agron.iastate.edu/lsr/#RLX/201606232158/201606232158"
711,2016-06-23 21:49:54+00:00,0,#RLX,None,0,"At 5:35 PM, 2 NW Amma [Roane Co, WV] PUBLIC reports FLASH FLOOD #RLX http://mesonet.agron.iastate.edu/lsr/#RLX/201606232135/201606232135",TX,1,iembot rlx,"iembot rlx At 5:35 PM, 2 NW Amma [Roane Co, WV] PUBLIC reports FLASH FLOOD #RLX http://mesonet.agron.iastate.edu/lsr/#RLX/201606232135/201606232135"
