,Date,Favorites,HashTags,Mentions,Retweets,Text,location,target,user_split,user_text
0,2019-07-19 22:40:31+00:00,0,#Respect,@BBCWorld @BigCatRescue,1,Nice to have a positive story about big cats for a change! #Respect India floods: Tired tiger takes nap in resident's bed via @BBCWorld https://www.bbc.com/news/world-asia-india-49041722 @BigCatRescue,WI,0,Gabriettaa,Gabriettaa Nice to have a positive story about big cats for a change! #Respect India floods: Tired tiger takes nap in resident's bed via @BBCWorld https://www.bbc.com/news/world-asia-india-49041722 @BigCatRescue
1,2019-07-19 22:26:34+00:00,0,None,None,0,my dad just told me to flood my car so I can get a new one.. alright bet,WI,1,chaaasiti04,chaaasiti04 my dad just told me to flood my car so I can get a new one.. alright bet
2,2019-07-19 22:19:05+00:00,1,None,None,2,"Happy B-day Reggie, from the office!!!",WI,1,JDenius,"JDenius Happy B-day Reggie, from the office!!!"
3,2019-07-19 22:17:13+00:00,0,None,None,0,Something about how crime will magically drop if we plant a few things in vacant lots,WI,1,beganovic2021,beganovic2021 Something about how crime will magically drop if we plant a few things in vacant lots
4,2019-07-19 20:57:18+00:00,0,None,None,0,Lol mine too. I’ve been avoiding floods for the simple fact ima be addicted to going and I’m at that age to embrace it lol sad but true,WI,1,RiskItAllRichy,RiskItAllRichy Lol mine too. I’ve been avoiding floods for the simple fact ima be addicted to going and I’m at that age to embrace it lol sad but true
5,2019-07-19 19:53:44+00:00,0,None,@RAGBRAI_IOWA,2,Riding the bus along I29 to @RAGBRAI_IOWA and seeing the lingering flood waters. Devastating,WI,1,CajunCy,CajunCy Riding the bus along I29 to @RAGBRAI_IOWA and seeing the lingering flood waters. Devastating
6,2019-07-19 19:45:14+00:00,1,None,None,4,The last guy that asked me out went MIA and implied that plans were canceled due to his car getting wrecked by a flood. The second guy had scheduling conflicts. The third guy just asked me to hang out at MY HOUSE. NIGGA.,WI,1,okmickeyy,okmickeyy The last guy that asked me out went MIA and implied that plans were canceled due to his car getting wrecked by a flood. The second guy had scheduling conflicts. The third guy just asked me to hang out at MY HOUSE. NIGGA.
7,2019-07-19 17:57:01+00:00,0,None,None,1,https://kttc.com/news/top-stories/2019/07/19/high-water-levels-flooded-fields-in-winona-county/ Flash floods in Pickwick – at Pickwick Mill,WI,1,KttcKilat,KttcKilat https://kttc.com/news/top-stories/2019/07/19/high-water-levels-flooded-fields-in-winona-county/ Flash floods in Pickwick – at Pickwick Mill
8,2019-07-19 17:50:48+00:00,0,None,None,1,"Yeah! If the world doesn’t melt, flood, or tornado away before then.",WI,1,jsgascoigne,"jsgascoigne Yeah! If the world doesn’t melt, flood, or tornado away before then."
9,2019-07-19 17:39:57+00:00,6,None,None,34,"When the sharpest words wanna cut me down I'm gonna send a flood, gonna drown them out I am brave, I am bruised I am who I'm meant to be, this is me Look out 'cause here I come And I'm marching on to the beat I drum I'm not scared to be seen I make no apologies, this is me ",WI,1,MrsKellyPierce,"MrsKellyPierce When the sharpest words wanna cut me down I'm gonna send a flood, gonna drown them out I am brave, I am bruised I am who I'm meant to be, this is me Look out 'cause here I come And I'm marching on to the beat I drum I'm not scared to be seen I make no apologies, this is me "
10,2019-07-19 16:43:49+00:00,3,#foxconn,@HowardELPC,4,@HowardELPC: the SBA disaster loan program will be more important than ever. Because of increase in flood intensity and frequency we must have more protection to mitigate where we can. In #foxconn type situations we need good permitting and impact studies to reduce pressure. – at Wheeling Town Hall,WI,1,DavidMcEllis,DavidMcEllis @HowardELPC: the SBA disaster loan program will be more important than ever. Because of increase in flood intensity and frequency we must have more protection to mitigate where we can. In #foxconn type situations we need good permitting and impact studies to reduce pressure. – at Wheeling Town Hall
11,2019-07-19 15:38:48+00:00,0,None,None,0,"Right? Lived in San Diego during the 80s and 90s. Not only did we have huge flooding issues, but lots of flash floods. Every night you’d see cars floating down what had previously been a river bad. Very scary.",WI,1,kpax512,"kpax512 Right? Lived in San Diego during the 80s and 90s. Not only did we have huge flooding issues, but lots of flash floods. Every night you’d see cars floating down what had previously been a river bad. Very scary."
12,2019-07-19 13:53:26+00:00,1,None,None,0,"At 6:15 PM CDT, 2 WNW Rolla [Phelps Co, MO] PUBLIC reports FLASH FLOOD. HWY Y AND E IN ROLLA WERE IMPASSABLE DUE TO FLOODING. DELAYED REPORT VIA SOCIAL MEDIA. https://mesonet.agron.iastate.edu/lsr/#SGF/201907172315/201907172315",WI,1,iembot sgf,"iembot sgf At 6:15 PM CDT, 2 WNW Rolla [Phelps Co, MO] PUBLIC reports FLASH FLOOD. HWY Y AND E IN ROLLA WERE IMPASSABLE DUE TO FLOODING. DELAYED REPORT VIA SOCIAL MEDIA. https://mesonet.agron.iastate.edu/lsr/#SGF/201907172315/201907172315"
13,2019-07-19 13:44:48+00:00,5,#ma #USA #Argentina #NoPlant19 #Corn #Flood #inundaciones #AgriTalk #agriculture #AgricShowUG2019 #AgricultureNews,@maxizavala,13,"Así están muchos lotes de #maíz en #USA debido a los excesos hídricos, siembra tardía y estrés por calor. Que decís ⁦@maxizavala⁩ tenemos maíz en #Argentina para reemplazarlo??? #NoPlant19 #Corn #Flood #inundaciones #AgriTalk #agriculture #AgricShowUG2019 #AgricultureNews",WI,1,mlopez stats,"mlopez stats Así están muchos lotes de #maíz en #USA debido a los excesos hídricos, siembra tardía y estrés por calor. Que decís ⁦@maxizavala⁩ tenemos maíz en #Argentina para reemplazarlo??? #NoPlant19 #Corn #Flood #inundaciones #AgriTalk #agriculture #AgricShowUG2019 #AgricultureNews"
14,2019-07-19 12:52:02+00:00,0,None,None,3,i can’t wait to go back to school and flood my life with music again ,WI,1,d cansler,d cansler i can’t wait to go back to school and flood my life with music again 
15,2019-07-19 12:14:59+00:00,2,#Likes #Follows #Instagram #googleads #digitalmarketing #seo #google #marketing #marketingdigital,@_d_a_n_i_e_l__b,2,Please flood @_d_a_n_i_e_l__b with #Likes and #Follows because #Instagram is censoring him rn. https://www.blurb.com/b/9419364-daniel-brummitt #googleads #digitalmarketing #seo #google #marketing #marketingdigital… https://www.instagram.com/p/B0GRQCGgi6x/?igshid=kkumb8tfkew7,WI,1,57KazqZ6UYIq2P2,57KazqZ6UYIq2P2 Please flood @_d_a_n_i_e_l__b with #Likes and #Follows because #Instagram is censoring him rn. https://www.blurb.com/b/9419364-daniel-brummitt #googleads #digitalmarketing #seo #google #marketing #marketingdigital… https://www.instagram.com/p/B0GRQCGgi6x/?igshid=kkumb8tfkew7
16,2019-07-19 12:07:40+00:00,0,None,None,0,"At 3:00 AM CDT, Stockton [Winona Co, MN] EMERGENCY MNGR reports FLASH FLOOD. EVIDENCE OF EARLIER FLASH FLOODING AT WACHOLTZ DRIVE https://mesonet.agron.iastate.edu/lsr/#ARX/201907190800/201907190800",WI,1,iembot arx,"iembot arx At 3:00 AM CDT, Stockton [Winona Co, MN] EMERGENCY MNGR reports FLASH FLOOD. EVIDENCE OF EARLIER FLASH FLOODING AT WACHOLTZ DRIVE https://mesonet.agron.iastate.edu/lsr/#ARX/201907190800/201907190800"
17,2019-07-19 12:07:39+00:00,0,None,None,0,"At 7:05 AM CDT, 2 NE Lewiston [Winona Co, MN] EMERGENCY MNGR reports FLASH FLOOD. FLASH FLOODING REPORTED IN FARMERS COMMUNITY PARK, INCLUDING WASHOUTS. https://mesonet.agron.iastate.edu/lsr/#ARX/201907191205/201907191205",WI,1,iembot arx,"iembot arx At 7:05 AM CDT, 2 NE Lewiston [Winona Co, MN] EMERGENCY MNGR reports FLASH FLOOD. FLASH FLOODING REPORTED IN FARMERS COMMUNITY PARK, INCLUDING WASHOUTS. https://mesonet.agron.iastate.edu/lsr/#ARX/201907191205/201907191205"
18,2019-07-19 11:13:35+00:00,0,None,None,1,I love being awake before my morning newsletters flood in tbh,WI,1,savsmithKC,savsmithKC I love being awake before my morning newsletters flood in tbh
19,2019-07-19 10:28:15+00:00,0,None,None,0,"At 5:22 AM CDT, 1 W Coon Valley [Vernon Co, WI] EMERGENCY MNGR reports FLASH FLOOD. HIGHWAY 14 BRIDGE IN COON VALLEY IS CLOSED DUE TO WATER OVER THE ROAD. https://mesonet.agron.iastate.edu/lsr/#ARX/201907191022/201907191022",WI,1,iembot arx,"iembot arx At 5:22 AM CDT, 1 W Coon Valley [Vernon Co, WI] EMERGENCY MNGR reports FLASH FLOOD. HIGHWAY 14 BRIDGE IN COON VALLEY IS CLOSED DUE TO WATER OVER THE ROAD. https://mesonet.agron.iastate.edu/lsr/#ARX/201907191022/201907191022"
20,2019-07-19 09:16:25+00:00,0,None,None,0,"At 4:13 AM CDT, 1 N Viroqua [Vernon Co, WI] LAW ENFORCEMENT reports FLASH FLOOD. WATER AND MUDSLIDE OVER COUNTY ROAD P EAST OF WESTBY. WATER OVER ROADWAY COUNTY ROAD P NORTH OF COON VALLEY. TEES DOWN EAST OF KICKAPOO RESERVE. https://mesonet.agron.iastate.edu/lsr/#ARX/201907190913/201907190913",WI,1,iembot arx,"iembot arx At 4:13 AM CDT, 1 N Viroqua [Vernon Co, WI] LAW ENFORCEMENT reports FLASH FLOOD. WATER AND MUDSLIDE OVER COUNTY ROAD P EAST OF WESTBY. WATER OVER ROADWAY COUNTY ROAD P NORTH OF COON VALLEY. TEES DOWN EAST OF KICKAPOO RESERVE. https://mesonet.agron.iastate.edu/lsr/#ARX/201907190913/201907190913"
21,2019-07-19 09:14:08+00:00,0,None,None,0,"At 4:03 AM CDT, 1 SSE Winona [Winona Co, MN] EMERGENCY MNGR reports FLASH FLOOD. ROCK SLIDE ON GARVIN HEIGHTS ROAD ON THE HILL IN THE CITY OF WINONA. https://mesonet.agron.iastate.edu/lsr/#ARX/201907190903/201907190903",WI,1,iembot arx,"iembot arx At 4:03 AM CDT, 1 SSE Winona [Winona Co, MN] EMERGENCY MNGR reports FLASH FLOOD. ROCK SLIDE ON GARVIN HEIGHTS ROAD ON THE HILL IN THE CITY OF WINONA. https://mesonet.agron.iastate.edu/lsr/#ARX/201907190903/201907190903"
22,2019-07-19 09:11:04+00:00,0,None,None,0,"At 3:55 AM CDT, 1 SSW Rockton [Vernon Co, WI] EMERGENCY MNGR reports FLASH FLOOD. CAMPERS HAD TO BE EVACUATED FROM KICKAPOO VALLEY RESERVE. SOME WASHOUTS STARTING IN THE COUNTY. KICKAPOO RIVER AND COON CREEK ARE OUT OF THEIR BANKS. https://mesonet.agron.iastate.edu/lsr/#ARX/201907190855/201907190855",WI,1,iembot arx,"iembot arx At 3:55 AM CDT, 1 SSW Rockton [Vernon Co, WI] EMERGENCY MNGR reports FLASH FLOOD. CAMPERS HAD TO BE EVACUATED FROM KICKAPOO VALLEY RESERVE. SOME WASHOUTS STARTING IN THE COUNTY. KICKAPOO RIVER AND COON CREEK ARE OUT OF THEIR BANKS. https://mesonet.agron.iastate.edu/lsr/#ARX/201907190855/201907190855"
23,2019-07-19 08:38:04+00:00,0,None,None,0,"At 2:56 AM CDT, 4 NE Ridgeway [Winona Co, MN] FIRE DEPT/RESCUE reports FLASH FLOOD. WATER OVER COUNTY ROAD 7. https://mesonet.agron.iastate.edu/lsr/#ARX/201907190756/201907190756",WI,1,iembot arx,"iembot arx At 2:56 AM CDT, 4 NE Ridgeway [Winona Co, MN] FIRE DEPT/RESCUE reports FLASH FLOOD. WATER OVER COUNTY ROAD 7. https://mesonet.agron.iastate.edu/lsr/#ARX/201907190756/201907190756"
24,2019-07-19 08:34:50+00:00,0,None,None,0,"At 2:56 AM CDT, 4 NE Ridgeway [Winona Co, MN] FIRE DEPT/RESCUE reports FLASH FLOOD. MUDSLIDES AND TREES DOWN ON COUNTY ROAD 7 BETWEEN PICKWICK AND WINONA COUNTY ROAD 12. https://mesonet.agron.iastate.edu/lsr/#ARX/201907190756/201907190756",WI,1,iembot arx,"iembot arx At 2:56 AM CDT, 4 NE Ridgeway [Winona Co, MN] FIRE DEPT/RESCUE reports FLASH FLOOD. MUDSLIDES AND TREES DOWN ON COUNTY ROAD 7 BETWEEN PICKWICK AND WINONA COUNTY ROAD 12. https://mesonet.agron.iastate.edu/lsr/#ARX/201907190756/201907190756"
25,2019-07-19 08:32:28+00:00,9,#TheResistance #VoteOutTheGOP #ClimateChange #OnePlanetOneHome #FactsMatter #Floods,@NOAA,11,"'Sunny day’ high tide floods are on the rise along U.S. coasts https://www.sciencenews.org/article/sunny-day-high-tide-floods-are-rise-along-us-coasts By 2050, sea level rise could make such flooding a new normal, a @NOAA report warns #TheResistance #VoteOutTheGOP #ClimateChange #OnePlanetOneHome #FactsMatter #Floods ",WI,1,ChristiAnne67,"ChristiAnne67 'Sunny day’ high tide floods are on the rise along U.S. coasts https://www.sciencenews.org/article/sunny-day-high-tide-floods-are-rise-along-us-coasts By 2050, sea level rise could make such flooding a new normal, a @NOAA report warns #TheResistance #VoteOutTheGOP #ClimateChange #OnePlanetOneHome #FactsMatter #Floods "
26,2019-07-19 06:55:18+00:00,1,None,@ChemDryByEdward,1,"Home, carpet, area rugs, tile, grout cleaning, leather, flood clean up are all services provided @ChemDryByEdward",WI,1,ChemDryByEdward,"ChemDryByEdward Home, carpet, area rugs, tile, grout cleaning, leather, flood clean up are all services provided @ChemDryByEdward"
27,2019-07-19 04:45:02+00:00,0,None,None,1,"Thanks for the invite brother. Man, I wish I could. Feel like I’m in a flood. One thing after another. We will definitely hook up though. I miss hanging out there. Got to definitely get back up that way ",WI,1,MardyKing1,"MardyKing1 Thanks for the invite brother. Man, I wish I could. Feel like I’m in a flood. One thing after another. We will definitely hook up though. I miss hanging out there. Got to definitely get back up that way "
28,2019-07-19 04:33:12+00:00,0,#downtowncharleston #SilverSurfer,None,0,Totally forgot how #downtowncharleston floods out with the drop of a 5-minute thunderstorm. Had to wade to the #SilverSurfer and let’s just say this little piggy is crying we-we-we all the way home! I thought those… https://www.instagram.com/p/B0FcZ4eh1WM/?igshid=1bgwcm10649ak,WI,1,jamestrabert,jamestrabert Totally forgot how #downtowncharleston floods out with the drop of a 5-minute thunderstorm. Had to wade to the #SilverSurfer and let’s just say this little piggy is crying we-we-we all the way home! I thought those… https://www.instagram.com/p/B0FcZ4eh1WM/?igshid=1bgwcm10649ak
29,2019-07-19 03:45:35+00:00,0,#ADE2019,None,3,"Thanks for the encouragement! The positivity the ADE community showed me really lifted me up. It is not easy to get up in packed hall of hundreds when the flood lights boom on you, the timer starts, and you have 3 minutes to share your story and deepest secrets. Thanks #ADE2019",WI,1,Johnalbert91,"Johnalbert91 Thanks for the encouragement! The positivity the ADE community showed me really lifted me up. It is not easy to get up in packed hall of hundreds when the flood lights boom on you, the timer starts, and you have 3 minutes to share your story and deepest secrets. Thanks #ADE2019"
30,2019-07-19 03:39:28+00:00,0,None,None,0,We must all keep retweeting to get this out there ... Fake News can ignore it but we can flood social media,WI,1,map301,map301 We must all keep retweeting to get this out there ... Fake News can ignore it but we can flood social media
31,2019-07-19 03:29:47+00:00,0,None,None,1,We’re choosing the rule of law. Obama said we’re a nation of laws. We are not going to let radical commies flood our country with criminals. We will secure the border and eliminate sanctuary cities.,WI,1,grykon,grykon We’re choosing the rule of law. Obama said we’re a nation of laws. We are not going to let radical commies flood our country with criminals. We will secure the border and eliminate sanctuary cities.
32,2019-07-19 03:16:55+00:00,2,#MYWAY #LINKINBIO #TooBusyWinning #FLOOD #FOE #SOLID #houston #rap,None,2,Don’t be that one mf that try to fuck up the vibe tomorrow please #MYWAY DROPS AT 12am Available for Pre Order NOW #LINKINBIO #TooBusyWinning #FLOOD #FOE #SOLID #houston #rap… https://www.instagram.com/p/B0FSx0ogMLc/?igshid=nv0gt8zsp02c,WI,0,TBWSirSpitta,TBWSirSpitta Don’t be that one mf that try to fuck up the vibe tomorrow please #MYWAY DROPS AT 12am Available for Pre Order NOW #LINKINBIO #TooBusyWinning #FLOOD #FOE #SOLID #houston #rap… https://www.instagram.com/p/B0FSx0ogMLc/?igshid=nv0gt8zsp02c
33,2019-07-19 03:14:41+00:00,0,None,None,1,"Limestone bike trails in a flood zone, none of the MN Nice, ""On your left,"" and it's perfectly fine to ride on a sidewalk or without a helmet. I kind of dig the bike culture in Winnipeg.",WI,1,NxNorthwoods,"NxNorthwoods Limestone bike trails in a flood zone, none of the MN Nice, ""On your left,"" and it's perfectly fine to ride on a sidewalk or without a helmet. I kind of dig the bike culture in Winnipeg."
34,2019-07-19 03:06:15+00:00,0,None,None,1,The last two times I went back to my hometown was 2017 and 2012. I’m having floods and floods of emotions about going back next week and I’m trying really hard to be strong enough to show Jake around the places the completely broke me.,WI,1,    Aubree    ,    Aubree     The last two times I went back to my hometown was 2017 and 2012. I’m having floods and floods of emotions about going back next week and I’m trying really hard to be strong enough to show Jake around the places the completely broke me.
35,2019-07-19 02:45:39+00:00,3,#LINKINBIO #TooBusyWinning #MYWAY #FLOOD #FOE #SOLID #wshh #gtdigitaldistribution #houston #bayarea,@GTDigitalDIST @Goldtoes415,2,"Go Pre Order “MY WAY” Now #LINKINBIO @GTDigitalDIST hempe4 @goldtoes415 tootiewootie #TooBusyWinning #MYWAY #FLOOD #FOE #SOLID #wshh #gtdigitaldistribution #houston #bayarea @Houston, Texas https://www.instagram.com/p/B0FP1Y7AuO2/?igshid=1anlunk3pztvr",WI,0,TBWSirSpitta,"TBWSirSpitta Go Pre Order “MY WAY” Now #LINKINBIO @GTDigitalDIST hempe4 @goldtoes415 tootiewootie #TooBusyWinning #MYWAY #FLOOD #FOE #SOLID #wshh #gtdigitaldistribution #houston #bayarea @Houston, Texas https://www.instagram.com/p/B0FP1Y7AuO2/?igshid=1anlunk3pztvr"
36,2019-07-19 02:40:52+00:00,2,#MYWAY #FLOOD #TooBusyWinning #FLOOD #FOE,@AppleMusic,1,PRE ORDER #MYWAY The link is in my bio @applemusic THANK EVERYBODY THAT BELIEVES In Me! Even if it’s just a lil bit! This is just the first step! AH AH AHHHHH #FLOOD #TooBusyWinning #FLOOD #FOE… https://www.instagram.com/p/B0FPjBoANl8/?igshid=ndu14kq9locr,WI,0,TBWSirSpitta,TBWSirSpitta PRE ORDER #MYWAY The link is in my bio @applemusic THANK EVERYBODY THAT BELIEVES In Me! Even if it’s just a lil bit! This is just the first step! AH AH AHHHHH #FLOOD #TooBusyWinning #FLOOD #FOE… https://www.instagram.com/p/B0FPjBoANl8/?igshid=ndu14kq9locr
37,2019-07-19 02:39:27+00:00,0,None,None,0,"Wow, you think of me so highly! I'm honored. In this new platform of mine, I will enforce eVerify. As well, I will help finish the wall to stop the onslaught of illegal aliens trying to flood over out border.",WI,1,JimmyXJames,"JimmyXJames Wow, you think of me so highly! I'm honored. In this new platform of mine, I will enforce eVerify. As well, I will help finish the wall to stop the onslaught of illegal aliens trying to flood over out border."
38,2019-07-19 02:28:47+00:00,1,None,None,0,"At 8:50 PM CDT, 8 ESE Rogersville [Limestone Co, AL] COUNTY OFFICIAL reports FLOOD. WATER IS REPORTED TO BE COVERING PARTS OF HARDY ROAD, HOLT SPRINGER ROAD, RIPLEY ROAD AND SNAKE ROAD NEAR ATHENS. https://mesonet.agron.iastate.edu/lsr/#HUN/201907190150/201907190150",WI,1,iembot hun,"iembot hun At 8:50 PM CDT, 8 ESE Rogersville [Limestone Co, AL] COUNTY OFFICIAL reports FLOOD. WATER IS REPORTED TO BE COVERING PARTS OF HARDY ROAD, HOLT SPRINGER ROAD, RIPLEY ROAD AND SNAKE ROAD NEAR ATHENS. https://mesonet.agron.iastate.edu/lsr/#HUN/201907190150/201907190150"
39,2019-07-19 02:20:29+00:00,1,None,None,0,"At 8:50 PM CDT, 6 ESE Rogersville [Limestone Co, AL] COUNTY OFFICIAL reports FLOOD. WATER IS COVERING PARTS OF HIGHWAY 72 IN ATHENS BETWEEN CLEMENTS HIGH SCHOOL AND CLEMENTS BAPTIST CHURCH. https://mesonet.agron.iastate.edu/lsr/#HUN/201907190150/201907190150",WI,1,iembot hun,"iembot hun At 8:50 PM CDT, 6 ESE Rogersville [Limestone Co, AL] COUNTY OFFICIAL reports FLOOD. WATER IS COVERING PARTS OF HIGHWAY 72 IN ATHENS BETWEEN CLEMENTS HIGH SCHOOL AND CLEMENTS BAPTIST CHURCH. https://mesonet.agron.iastate.edu/lsr/#HUN/201907190150/201907190150"
40,2019-07-19 02:19:31+00:00,0,None,None,0,"Mother Nature / God / Kami keeps reminding this province climate change is real, but these people refuse to believe it. Forest fires, droughts, floods, snow in July, hail... What more for evidence? ",WI,1,jonnyquesty2k,"jonnyquesty2k Mother Nature / God / Kami keeps reminding this province climate change is real, but these people refuse to believe it. Forest fires, droughts, floods, snow in July, hail... What more for evidence? "
41,2019-07-19 01:53:17+00:00,0,None,None,39,"the CATS trailer brought a flood of emotions that I didn’t expect, but perhaps the most unexpected was the pure ANGER I felt when a friend, after seeing the trailer for the first time, said “cats don’t have lips though”",WI,1,ashtonevans,"ashtonevans the CATS trailer brought a flood of emotions that I didn’t expect, but perhaps the most unexpected was the pure ANGER I felt when a friend, after seeing the trailer for the first time, said “cats don’t have lips though”"
42,2019-07-19 01:47:04+00:00,0,None,None,0,Flash flood!,WI,1,DryHeatBlog,DryHeatBlog Flash flood!
43,2019-07-19 01:38:43+00:00,0,None,None,0,Doug McNeil is a flood expert from Manitoba It is hoped Doug Ford will ultimately honour Mr. McNeil's recommendations.,WI,1,TyroneStreete2,TyroneStreete2 Doug McNeil is a flood expert from Manitoba It is hoped Doug Ford will ultimately honour Mr. McNeil's recommendations.
44,2019-07-19 01:33:42+00:00,0,None,None,0,"At 8:15 PM CDT, 3 N Rogersville [Lauderdale Co, AL] PUBLIC reports FLOOD. THE ROAD ALONG COUNTY ROAD 123 AND COUNTY ROAD 76 NEAR ROGERSVILLE IS IMPASSABLE DUE TO WATER COVERING THE ROAD. https://mesonet.agron.iastate.edu/lsr/#HUN/201907190115/201907190115",WI,1,iembot hun,"iembot hun At 8:15 PM CDT, 3 N Rogersville [Lauderdale Co, AL] PUBLIC reports FLOOD. THE ROAD ALONG COUNTY ROAD 123 AND COUNTY ROAD 76 NEAR ROGERSVILLE IS IMPASSABLE DUE TO WATER COVERING THE ROAD. https://mesonet.agron.iastate.edu/lsr/#HUN/201907190115/201907190115"
45,2019-07-19 01:27:40+00:00,0,#EndoJC,@RWJMS,9,"#EndoJC David Cohen, endocrinologist &amp; Vice Chair of Medicine at @RWJMS in NJ. Checking in while I clean the FLOOD IN MY BASEMENT!!! ",WI,1,DavidACohen MD,"DavidACohen MD #EndoJC David Cohen, endocrinologist &amp; Vice Chair of Medicine at @RWJMS in NJ. Checking in while I clean the FLOOD IN MY BASEMENT!!! "
46,2019-07-19 01:23:22+00:00,0,None,None,2, ,WI,1,kristy527,kristy527  
47,2019-07-19 01:22:49+00:00,0,None,None,0,"At 8:05 PM CDT, 3 S Lexington [Lauderdale Co, AL] EMERGENCY MNGR reports FLASH FLOOD. WATER FLOWING OVER THE ROAD AND INTO THE FRONT LAWN OF A HOME ALONG THE 7700 BLOCK ON HIGHWAY 101 NEAR LEXINGTON. https://mesonet.agron.iastate.edu/lsr/#HUN/201907190105/201907190105",WI,1,iembot hun,"iembot hun At 8:05 PM CDT, 3 S Lexington [Lauderdale Co, AL] EMERGENCY MNGR reports FLASH FLOOD. WATER FLOWING OVER THE ROAD AND INTO THE FRONT LAWN OF A HOME ALONG THE 7700 BLOCK ON HIGHWAY 101 NEAR LEXINGTON. https://mesonet.agron.iastate.edu/lsr/#HUN/201907190105/201907190105"
48,2019-07-19 01:17:50+00:00,2,None,None,1,Either drought or flood. This region can’t catch a break. ,WI,1,therockyfiles,therockyfiles Either drought or flood. This region can’t catch a break. 
49,2019-07-19 00:49:58+00:00,0,#climatechange #ClimateCrisis #ClimateActionNow,None,3,"I did not know about this organization called CGIAR, which is doing a commendable job of designing seeds which is more tolerant to climate change, i.e., to extreme heat or flood situations. #climatechange #ClimateCrisis #ClimateActionNow",WI,1,swadhin pradhan,"swadhin pradhan I did not know about this organization called CGIAR, which is doing a commendable job of designing seeds which is more tolerant to climate change, i.e., to extreme heat or flood situations. #climatechange #ClimateCrisis #ClimateActionNow"
50,2019-07-19 00:46:54+00:00,0,None,None,0,"You greedy old fool. Gaslighting away thinking your tiny little white base, gerrymandering and voter suppression is going to lift you out of the flood of justice coming your way in 2020.",WI,1,Lianne1,"Lianne1 You greedy old fool. Gaslighting away thinking your tiny little white base, gerrymandering and voter suppression is going to lift you out of the flood of justice coming your way in 2020."
51,2019-07-19 00:46:13+00:00,0,None,None,0,This has me in floods of relief. ,WI,1,aimless is more,aimless is more This has me in floods of relief. 
52,2019-07-19 00:38:32+00:00,0,None,None,0,If they're lucky it'll flood tonight,WI,1,natecancook,natecancook If they're lucky it'll flood tonight
53,2019-07-19 00:33:54+00:00,0,None,None,1,We’ve been flood warned since about 5pm locally. It’s been a wet one!,WI,1,babowling12,babowling12 We’ve been flood warned since about 5pm locally. It’s been a wet one!
54,2019-07-19 00:30:27+00:00,0,None,None,0,"At 6:45 PM EDT, Clark [Union Co, NJ] LAW ENFORCEMENT reports FLASH FLOOD. MULTIPLE REPORTS OF PEOPLE RESCUED FROM VEHICLES IN CLARK, UNION COUNTY. https://mesonet.agron.iastate.edu/lsr/#OKX/201907182245/201907182245",WI,1,iembot okx,"iembot okx At 6:45 PM EDT, Clark [Union Co, NJ] LAW ENFORCEMENT reports FLASH FLOOD. MULTIPLE REPORTS OF PEOPLE RESCUED FROM VEHICLES IN CLARK, UNION COUNTY. https://mesonet.agron.iastate.edu/lsr/#OKX/201907182245/201907182245"
55,2019-07-19 00:27:21+00:00,0,None,None,0,"At 7:00 PM EDT, Montgomery TWP [Somerset Co, NJ] 911 CALL CENTER reports FLASH FLOOD. ROUTE 206 IN MONTGOMERY CLOSED DUE TO FLOODING. TIME OF REPORT ESTIMATED. https://mesonet.agron.iastate.edu/lsr/#PHI/201907182300/201907182300",WI,1,iembot phi,"iembot phi At 7:00 PM EDT, Montgomery TWP [Somerset Co, NJ] 911 CALL CENTER reports FLASH FLOOD. ROUTE 206 IN MONTGOMERY CLOSED DUE TO FLOODING. TIME OF REPORT ESTIMATED. https://mesonet.agron.iastate.edu/lsr/#PHI/201907182300/201907182300"
56,2019-07-19 00:19:19+00:00,1,None,None,2,"CNN July Debate Question; Most important Debate Question Please Vote Re-tweet or post yourself, lets flood CNN ",WI,1,BakerLackey,"BakerLackey CNN July Debate Question; Most important Debate Question Please Vote Re-tweet or post yourself, lets flood CNN "
